{
  "$schema": "https://json-schema.org/draft/2020-12/schema",
  "$id": "https://example.local/opencode/skills/quote-feedback-reference-skill/references/output.schema.json",
  "type": "object",
  "additionalProperties": false,
  "required": ["matches", "applicable_preferences", "applicable_rules", "forbidden_patterns", "recommended_adjustments", "review_alerts", "confidence"],
  "properties": {
    "matches": { "type": "array", "items": { "type": "object" } },
    "applicable_preferences": { "type": "array", "items": { "type": "object" } },
    "applicable_rules": { "type": "array", "items": { "type": "object" } },
    "forbidden_patterns": { "type": "array", "items": { "type": "object" } },
    "recommended_adjustments": { "type": "array", "items": { "type": "object" } },
    "review_alerts": { "type": "array", "items": { "type": "string" } },
    "confidence": { "type": "number", "minimum": 0, "maximum": 1 }
  }
}
